{
  "schema_version": 1,
  "subject": "g10_m134_frame_capture_pipeline",
  "symbolic_gate_key": "g10.p0.m134.frame_capture_pipeline",
  "matrix_row": "M134",
  "milestone": "M134",
  "assertion_id": "g10.p0.m134.frame_capture_pipeline",
  "status": "fail",
  "wave": "G10.4",
  "numeric_step": 181,
  "source_ref": "RFC-0026 §4.1;spec/imageio.md RXS-0385;spec/visual_comparison.md RXS-0386;G10_ACCEPTANCE_MAP §1 M134",
  "base_commit": "7689674d08411c6906a9a1e27dd5ca7670f436a3",
  "host_section_pass": false,
  "device_section_state": "fail",
  "checks": {
    "spec_rxs0385_clause_on_tree": true,
    "spec_rxs0386_clause_on_tree": true,
    "imageio_exr_unit_tests": true,
    "harness_build_vulkan": true,
    "harness_checks_all_true": false,
    "device_section_executed": false,
    "metadata_closed_set_complete": false,
    "cross_impl_digest_match": false,
    "ue_frame_strip_and_log": false,
    "zip_decode_fail_closed": false,
    "red_bit_depth_truncation_detected": false,
    "red_srgb_linear_mislabel_detected": false,
    "red_metadata_missing_detected": false
  },
  "commands": [
    {
      "seq": 1,
      "command": "cargo test -p image-io",
      "exit_code": 0
    },
    {
      "seq": 2,
      "command": "cargo build -p rurix-render --features vulkan --bin g10_m134_frame_capture",
      "exit_code": 0
    },
    {
      "seq": 3,
      "command": "H:\\rurix\\target\\debug\\g10_m134_frame_capture.exe --evidence H:\\rurix\\.tmp\\g104_gates\\m134\\harness_evidence.json --ue-frame K:\\rurix-ext\\g10-frames\\g10_gate_runs\\m128_20260815T164025Z\\.0000.exr --work-dir H:\\rurix\\.tmp\\g104_gates\\m134",
      "exit_code": 1
    }
  ],
  "capture_report": {
    "harness": "g10_m134_frame_capture",
    "harness_evidence": ".tmp/g104_gates/m134/harness_evidence.json",
    "host_frame_digest": "",
    "host_exr_file_digest": "",
    "device_frame_digest": "",
    "device_name": "",
    "ue_frame": "K:\\rurix-ext\\g10-frames\\g10_gate_runs\\m128_20260815T164025Z\\.0000.exr",
    "ue_frame_digest": "",
    "ue_frame_bit_depth": "",
    "ue_stripped_attribute_count": 0,
    "exr_subset": "scanline float32 RGB/Y; compression v1 = NONE 编+解; ZIP fail-closed 显式 UnsupportedCompression（禁静默）",
    "compression_narrowing": "harness 收窄登记 = {NONE}（UE 5.8.1 MRQ 帧 compression=NONE 实测）",
    "cross_impl_verification": "ci/g10_exr_lib.py 独立第二实现（Python）互核元数据闭集 + 帧 digest 互证"
  },
  "evidence_level": "measured_local",
  "run_url": "",
  "timestamp": "20260815T180226Z",
  "environment": {
    "os": "Windows-11-10.0.28120-SP0",
    "python_version": "3.12.1",
    "cargo_version": "cargo 1.93.1 (083ac5135 2025-12-15)",
    "rustc_version": "rustc 1.93.1 (01f6ddf75 2026-02-11)"
  },
  "notes": "harness 非零退出: G10_M134_FC: checks 9/10 device=executed host_digest=sha256:d2104ebf7992927d3\n[G10_M134_FC] RED 检出 clamp-8bit: 9213 像素位级偏离探针先验\n[G10_M134_FC] RED 检出 srgb-linear-mislabel: 混标构造被拒\n[G10_M134_FC] RED 检出 metadata-missing: 缺字段帧被拒\n[G10_M134_FC] device 腿: device=`NVIDIA GeForce RTX 4070 Ti` covered=968 corner=(0.0, 0.0, 0.0) center=(0.5107422, 0.2331543, 0.2553711)\n[G10_M134_FC] evidence → H:\\rurix\\.tmp\\g104_gates\\m134\\harness_evidence.json\nG10_M134_FC: FAIL 判据失效: [\"UE 真帧解码失败: image-io: EXR 非法: EXR version 字段非 v2 scanline: [02, 04, 00, 00]\", \"UE 真帧 strip-and-log 读取判据失效\"]; harness checks 非全真: []; device 腿未 executed: fail; 元数据闭集齐备性独立互核失败（分辨率/色彩空间/位深/九字段）; 跨实现帧 digest 互证不一致（Rust bin vs ci Python 独立解析器）; UE 真帧 strip-and-log 读取判据失效; ZIP fail-closed 失效; harness RED 臂内联实测漏检"
}
